{
  "schema": "./registry.schema.json",
  "version": "1.3.0",
  "updated": "2026-06-05",
  "org": "FlexNetOS",
  "description": "Canonical registry of MCP servers used across the FlexNetOS meta workspace.",
  "servers": [
    {
      "id": "meta",
      "displayName": "meta-mcp",
      "kind": "local",
      "hosting": "peer",
      "runner": "binary",
      "transport": "stdio",
      "command": "meta-mcp",
      "args": [],
      "repo": "git@github.com:FlexNetOS/meta_mcp.git",
      "workspaceMember": "meta_mcp",
      "status": "stable",
      "toolPrefix": "meta_",
      "toolCount": 29,
      "auth": "none",
      "summary": "Multi-repo operations for the meta workspace: project listing, cross-repo git, build/test orchestration, code search, dependency/impact analysis, and snapshots.",
      "doc": "servers/meta_mcp.md",
      "snippet": "snippets/meta.mcp.json"
    },
    {
      "id": "weave",
      "displayName": "weave",
      "kind": "local",
      "hosting": "peer",
      "runner": "binary",
      "transport": "stdio",
      "command": "weave",
      "args": [
        "mcp"
      ],
      "repo": "git@github.com:FlexNetOS/weave.git",
      "workspaceMember": "weave",
      "status": "stable",
      "toolPrefix": "weave_",
      "toolCount": 11,
      "auth": "none",
      "summary": "Rust-native agent-to-agent session mesh. Lets coding-agent sessions message each other and pushes live nudges into a peer's tmux/zellij pane.",
      "doc": "servers/weave.md",
      "snippet": "snippets/weave.mcp.json"
    },
    {
      "id": "n8n-mcp",
      "displayName": "n8n-mcp",
      "kind": "external",
      "hosting": "mcp_hub-child",
      "runner": "npx",
      "transport": "stdio",
      "command": "npx",
      "args": [
        "n8n-mcp"
      ],
      "env": {
        "MCP_MODE": "stdio",
        "LOG_LEVEL": "error",
        "DISABLE_CONSOLE_OUTPUT": "true",
        "N8N_API_URL": "https://your-n8n-instance.com",
        "N8N_API_KEY": "<your-n8n-api-key>"
      },
      "repo": "git@github.com:FlexNetOS/n8n-mcp.git",
      "status": "stable",
      "auth": "api-key",
      "requiresApi": true,
      "summary": "Build and manage n8n workflows from an agent. 7 core node-documentation/validation tools work with no credentials; 13 management tools (create/update/run workflows, executions, credentials) require an n8n API URL + key.",
      "doc": "servers/n8n-mcp.md",
      "snippet": "snippets/n8n-mcp.mcp.json",
      "notes": "Fork of czlonkowski/n8n-mcp (TypeScript, MIT). Runs via `npx n8n-mcp` or the ghcr.io/czlonkowski/n8n-mcp Docker image. Not a meta workspace member.",
      "subPath": "n8n-mcp"
    },
    {
      "id": "cloudflare",
      "displayName": "Cloudflare Developer Platform",
      "kind": "remote",
      "hosting": "registry-only",
      "runner": "http",
      "transport": "http",
      "url": "https://<provisioned-by-claude.ai>/cloudflare/mcp",
      "connector": "claude.ai",
      "status": "stable",
      "toolPrefix": "mcp__claude_ai_Cloudflare_Developer_Platform__",
      "auth": "oauth",
      "summary": "Cloudflare developer platform operations (Workers, KV, R2, etc.) via the claude.ai OAuth connector.",
      "doc": "servers/claude-ai-connectors.md",
      "snippet": "snippets/claude-ai.mcp.json"
    },
    {
      "id": "figma",
      "displayName": "Figma",
      "kind": "remote",
      "hosting": "registry-only",
      "runner": "http",
      "transport": "http",
      "url": "https://<provisioned-by-claude.ai>/figma/mcp",
      "connector": "claude.ai",
      "status": "stable",
      "toolPrefix": "mcp__claude_ai_Figma__",
      "auth": "oauth",
      "summary": "Read designs from Figma into code and write designs into Figma (Code Connect, screenshots, diagrams, design systems).",
      "doc": "servers/claude-ai-connectors.md",
      "snippet": "snippets/claude-ai.mcp.json"
    },
    {
      "id": "gmail",
      "displayName": "Gmail",
      "kind": "remote",
      "hosting": "registry-only",
      "runner": "http",
      "transport": "http",
      "url": "https://<provisioned-by-claude.ai>/gmail/mcp",
      "connector": "claude.ai",
      "status": "stable",
      "toolPrefix": "mcp__claude_ai_Gmail__",
      "auth": "oauth",
      "summary": "Gmail threads, drafts, and labels via the claude.ai OAuth connector.",
      "doc": "servers/claude-ai-connectors.md",
      "snippet": "snippets/claude-ai.mcp.json"
    },
    {
      "id": "google-calendar",
      "displayName": "Google Calendar",
      "kind": "remote",
      "hosting": "registry-only",
      "runner": "http",
      "transport": "http",
      "url": "https://<provisioned-by-claude.ai>/google-calendar/mcp",
      "connector": "claude.ai",
      "status": "stable",
      "toolPrefix": "mcp__claude_ai_Google_Calendar__",
      "auth": "oauth",
      "summary": "Google Calendar events, availability, and scheduling via the claude.ai OAuth connector.",
      "doc": "servers/claude-ai-connectors.md",
      "snippet": "snippets/claude-ai.mcp.json"
    },
    {
      "id": "google-drive",
      "displayName": "Google Drive",
      "kind": "remote",
      "hosting": "registry-only",
      "runner": "http",
      "transport": "http",
      "url": "https://<provisioned-by-claude.ai>/google-drive/mcp",
      "connector": "claude.ai",
      "status": "stable",
      "toolPrefix": "mcp__claude_ai_Google_Drive__",
      "auth": "oauth",
      "summary": "Google Drive file search, read, and management via the claude.ai OAuth connector.",
      "doc": "servers/claude-ai-connectors.md",
      "snippet": "snippets/claude-ai.mcp.json"
    },
    {
      "id": "hugging-face",
      "displayName": "Hugging Face",
      "kind": "remote",
      "hosting": "registry-only",
      "runner": "http",
      "transport": "http",
      "url": "https://<provisioned-by-claude.ai>/hugging-face/mcp",
      "connector": "claude.ai",
      "status": "stable",
      "toolPrefix": "mcp__claude_ai_Hugging_Face__",
      "auth": "oauth",
      "summary": "Hugging Face Hub: models, datasets, papers, spaces, and docs via the claude.ai OAuth connector.",
      "doc": "servers/claude-ai-connectors.md",
      "snippet": "snippets/claude-ai.mcp.json"
    },
    {
      "id": "microsoft-365",
      "displayName": "Microsoft 365",
      "kind": "remote",
      "hosting": "registry-only",
      "runner": "http",
      "transport": "http",
      "url": "https://<provisioned-by-claude.ai>/microsoft-365/mcp",
      "connector": "claude.ai",
      "status": "stable",
      "toolPrefix": "mcp__claude_ai_Microsoft_365__",
      "auth": "oauth",
      "summary": "Microsoft 365: Outlook mail/calendar, Teams chat, and SharePoint search via the claude.ai OAuth connector.",
      "doc": "servers/claude-ai-connectors.md",
      "snippet": "snippets/claude-ai.mcp.json"
    },
    {
      "id": "notion",
      "displayName": "Notion",
      "kind": "remote",
      "hosting": "registry-only",
      "runner": "http",
      "transport": "http",
      "url": "https://<provisioned-by-claude.ai>/notion/mcp",
      "connector": "claude.ai",
      "status": "stable",
      "toolPrefix": "mcp__claude_ai_Notion__",
      "auth": "oauth",
      "summary": "Notion pages, databases, comments, and search via the claude.ai OAuth connector.",
      "doc": "servers/claude-ai-connectors.md",
      "snippet": "snippets/claude-ai.mcp.json"
    }
  ]
}
